sep=,
,"French startup Heetch has been around for quite a few years. Although things were running smoothly, the company had to start over mostly from scratch. In March 2017, a court in Paris ruled that Heetch had been illegally operating a transportation company. The startup is now rising from the ashes and raising $12 million to fund its new service. Read More",https://techcrunch.com/2017/09/29/heetch-raises-12-million-to-reboot-its-ride-sharing-service/,Heetch raises $12 million to reboot its ridesharing service,
,"TechCrunch has learned that Apple has acquired a small French startup called Regaind, according to multiple sources. As always, Apple is very quiet when it comes to acquisitions, but it’s always interesting to learn more about Apple’s interests.
We’ve reached out to Apple and the company sent us the following statement: “Apple buys smaller technology companies from time… Read More",https://techcrunch.com/2017/09/29/apple-quietly-acquires-computer-vision-startup-regaind/,Apple quietly acquired computer vision startup Regaind,
,"It’s been a busy year for Sphero, with the release of products like R2-D2, Spider-Man and Lightning McQueen. But the robotic toy startup is still making non-licensed, non-tie in products too — including the Sphero Mini, its most affordable toy yet.
“We wanted to make Sphero products accessible to everyone,” said co-founder and Chief Software Architect Adam Wilson.
The… Read More",https://techcrunch.com/2017/09/29/sphero-mini/,"With the Sphero Mini, you get a robotic ball for just $49.99",
,"Elon Musk gave a keynote address yesterday to the International Aeronautical Congress in Adelaide, Australia. During the 43 minute talk, which is embedded above, Musk laid out SpaceX’s future including colonizing Mars and building one rocket to rule them all.
The talk is fantastic. Elon was Elon and revealed countless details about future SpaceX plans. This is why he’s celebrated… Read More",https://techcrunch.com/2017/09/29/watch-elon-musks-keynote-where-he-announced-spacexs-new-rocket-and-mars-colonization/,Watch Elon Musk’s keynote where he announced SpaceX’s new rocket and Mars colonization,
,"The 12 startups of Techstars NYC‘s latest class are taking over tonight’s NY Tech Meetup.
This “community demo day” is part of Managing Director Alex Iskold attempt to rethink the traditional accelerator demo day. (Don’t worry, the startups will get to meet with investors too, through one-on-one sessions during Techstars’ investor week.)
I recently visited… Read More",https://techcrunch.com/2017/09/28/techstars-nyc-summer-2017/,Here are the 12 startups in Techstars NYC’s Summer 2017 class,
,,,,
